{
  "$schema": "http://json-schema.org/draft-04/schema#",
  "title":"Paypal List",
  "type":"object",
  "properties":
  {
    "clientId":
    {
      "type":"string"
    },
    "clientSecretId":
    {
      "type":"string"
    },
    "createdAt":
    {
      "type":"string",
      "format":"date-time"
    },
    "items":
    {
      "type":"array",
      "items":
      {
        "$ref":"paypalItem"
      }
    }
  },
  "required":["clientId", "clientSecretId"]
}