{
  "clientId":"AeruG19el8CaACWUYEDMyvBXbZlQ07rnPhN8asdR3r43E4ZOKXvFOVZ",
  "clientSecretId":"345MWyh7w4hY98W6",
  "createdAt":"2012-07-12T12:42:23.777Z",
   "items":
    [
      {
        "mode":"sandbox",
        "successUrl":"http://myApi.de/paypalafo/345MWyh7w4hY98W6",
        "cancelUrl":"http://myApi.de/paypalafo/345MWyh7w4hY98W6"
      },
      {
        "mode":"sandbox",
        "successUrl":"http://myApi.de/paypalafo/345MWyh7w4hY98W6",
        "cancelUrl":"http://myApi.de/paypalafo/345MWyh7w4hY98W6"
      }
    ]
}
